{
  "$schema": "https://json-schema.org/draft/2020-12/schema",
  "$id": "https://8978.ai/schemas/development-resource-creation-completion-record.schema.json",
  "type": "object",
  "additionalProperties": false,
  "required": ["schemaVersion","status","governing","environment","phase","recordedAt","sourcePacket","sourcePartialRecord","ownerDecision","authorityDatabase","queue","sameNamedWorker","workflow","externalEffects","continuation","verification"],
  "properties": {
    "schemaVersion":{"const":"1.0.0"},"status":{"const":"RESOURCE_CREATION_COMPLETED_UNBOUND"},"governing":{"const":false},
    "environment":{"const":"development"},"phase":{"const":"record_completed_unbound_resource_creation"},"recordedAt":{"const":"2026-08-18T19:37:23Z"},
    "sourcePacket":{"type":"object","additionalProperties":false,"required":["path","sha256","reviewedHead","mergeCommit"],"properties":{"path":{"const":"deployment/development-resource-creation-packet.json"},"sha256":{"const":"a3dd1fe2657818a068bdb1095df82eeed00af8642d412b65b2e6b1aad5720f0a"},"reviewedHead":{"const":"604604473cadf68a7f26732b45314c2c8af288d2"},"mergeCommit":{"const":"fd5f218158f57bf4efd18d01466e20a743abe5d4"}}},
    "sourcePartialRecord":{"type":"object","additionalProperties":false,"required":["path","sha256","reviewedHead","mergeCommit"],"properties":{"path":{"const":"deployment/development-resource-creation-partial-execution-record.json"},"sha256":{"const":"83944ee501f17eed7072412cf1be380333e823856cc904872fed275d57504345"},"reviewedHead":{"const":"a1cf2e1c9fe2ed95aea2b0010a3753f5658a9059"},"mergeCommit":{"const":"240e3ef94067bf60535ed258769b5c223f943ee0"}}},
    "ownerDecision":{"type":"object","additionalProperties":false,"required":["accountName","accountId","wnamAccepted","retainDatabaseWithoutDeletionOrRecreation","queueCreationAuthorized","queueCreationMethod","activationAuthorized","workerDeploymentAuthorized"],"properties":{"accountName":{"const":"smartsitecapture.com"},"accountId":{"const":"de5e0273347b0b4c5f8f4e554aa2288f"},"wnamAccepted":{"const":true},"retainDatabaseWithoutDeletionOrRecreation":{"const":true},"queueCreationAuthorized":{"const":true},"queueCreationMethod":{"const":"cloudflare_dashboard_manual"},"activationAuthorized":{"const":false},"workerDeploymentAuthorized":{"const":false}}},
    "authorityDatabase":{"type":"object","additionalProperties":false,"required":["outcome","name","databaseId","createdAt","actualRegion","jurisdiction","readReplication","numTables","fileSizeBytes","ownerAccepted","sqlExecuted","migrationsApplied","dataInserted","bindingInstalled","deleteAuthorized"],"properties":{"outcome":{"const":"CREATED_UNCHANGED"},"name":{"const":"8978-ai-authority-dev"},"databaseId":{"const":"741ade94-8539-4fc8-b6be-24884720dee8"},"createdAt":{"const":"2026-08-18T17:17:23.103Z"},"actualRegion":{"const":"WNAM"},"jurisdiction":{"type":"null"},"readReplication":{"const":"disabled"},"numTables":{"const":0},"fileSizeBytes":{"const":12288},"ownerAccepted":{"const":true},"sqlExecuted":{"const":false},"migrationsApplied":{"const":false},"dataInserted":{"const":false},"bindingInstalled":{"const":false},"deleteAuthorized":{"const":false}}},
    "queue":{"type":"object","additionalProperties":false,"required":["operation","outcome","name","queueId","createdAt","exactNameMatchCount","deliveryDelaySeconds","messageRetentionSeconds","operationalStatus","inactivityAssessment","bindingStatus","producerStatus","consumerStatus","messagePublicationStatus","independentVerificationStatus"],"properties":{"operation":{"const":"create"},"outcome":{"const":"CREATED_OWNER_ATTESTED"},"name":{"const":"8978-ai-orchestrator-dev"},"queueId":{"const":"fe649364dd804ebd984297b68da6a534"},"createdAt":{"type":"null"},"exactNameMatchCount":{"const":"UNVERIFIED_BY_TOOL"},"deliveryDelaySeconds":{"const":0},"messageRetentionSeconds":{"const":86400},"operationalStatus":{"const":"INACTIVE"},"inactivityAssessment":{"const":"EXPECTED_UNCONNECTED"},"bindingStatus":{"const":"OWNER_ATTESTED_NONE_WITH_TIMESTAMP_INFERENCE"},"producerStatus":{"const":"OWNER_ATTESTED_NONE"},"consumerStatus":{"const":"OWNER_ATTESTED_NONE"},"messagePublicationStatus":{"const":"UNVERIFIED"},"independentVerificationStatus":{"const":"TOOLING_UNAVAILABLE"}}},
    "sameNamedWorker":{"type":"object","additionalProperties":false,"required":["exists","name","workerId","createdAt","modifiedAt","separateResourceNamespace","technicalCollision","renameAuthorized"],"properties":{"exists":{"const":true},"name":{"const":"8978-ai-orchestrator-dev"},"workerId":{"const":"7d8fe11595134e5980a2c888a805ff03"},"createdAt":{"const":"2026-08-11T16:41:29Z"},"modifiedAt":{"const":"2026-08-11T16:43:02Z"},"separateResourceNamespace":{"const":true},"technicalCollision":{"const":false},"renameAuthorized":{"const":false}}},
    "workflow":{"type":"object","additionalProperties":false,"required":["operation","existence","changed"],"properties":{"operation":{"const":"NOT_ATTEMPTED"},"existence":{"const":"UNVERIFIED_TOOLING_UNAVAILABLE"},"changed":{"const":false}}},
    "externalEffects":{"type":"object","additionalProperties":false,"required":["queueCreated","workerDeployed","configurationChanged","routeChanged","secretOrKeyChanged","activationPerformed","automaticRetryPerformed","automaticCleanupPerformed"],"properties":{"queueCreated":{"const":true},"workerDeployed":{"const":false},"configurationChanged":{"const":false},"routeChanged":{"const":false},"secretOrKeyChanged":{"const":false},"activationPerformed":{"const":false},"automaticRetryPerformed":{"const":false},"automaticCleanupPerformed":{"const":false}}},
    "continuation":{"type":"object","additionalProperties":false,"required":["authorized","activationAuthorized","workerDeploymentAuthorized","nextPermittedRepositoryAction"],"properties":{"authorized":{"const":false},"activationAuthorized":{"const":false},"workerDeploymentAuthorized":{"const":false},"nextPermittedRepositoryAction":{"const":"independent_review_of_this_code_only_record"}}},
    "verification":{"type":"object","additionalProperties":false,"required":["method","d1CheckerVerdict","queueCheckerVerdict","limitations"],"properties":{"method":{"const":"MIXED_D1_API_AND_OWNER_QUEUE_ATTESTATION"},"d1CheckerVerdict":{"const":"D1_REVERIFIED_UNCHANGED"},"queueCheckerVerdict":{"const":"CLAUDE READ-ONLY VERIFICATION: QUEUE TOOLING UNAVAILABLE"},"limitations":{"type":"array","minItems":6,"maxItems":6,"items":{"type":"string","minLength":1}}}}
  }
}
